{
  "session_id": "550e8400-e29b-41d4-a716-446655440000",
  "feature_request": "Implement user authentication with OAuth support",
  "status": "completed",
  "current_phase": "cleanup",
  "created_at": "2026-01-07T10:00:00Z",
  "updated_at": "2026-01-07T10:47:23Z",
  "completed_at": "2026-01-07T10:47:23Z",
  "git_context": {
    "branch": "feat/oauth-authentication",
    "commit": "b9dc8fd35ba862a6b43a7fb1f681f09eba00b4d7",
    "repo_root": "/home/user/projects/myapp",
    "is_worktree": true,
    "worktree_name": "myapp.feat-oauth"
  },
  "prd_reference": {
    "filename": "prd-oauth-authentication-v1.md",
    "path": "/home/user/projects/myapp/.flow/prd-oauth-authentication-v1.md",
    "version": "v1"
  },
  "statistics": {
    "total_tasks": 12,
    "completed_tasks": 12,
    "failed_tasks": 0,
    "decisions_made": 8,
    "checkpoints_created": 2,
    "error_recovery_count": 1,
    "duration_seconds": 2843
  },
  "configuration": {
    "max_iterations": 3,
    "timeout_minutes": 120,
    "auto_checkpoint": true,
    "error_recovery_enabled": true
  }
}
