{
  "session_id": "6048df43-312b-4b9e-bd0c-bc4018d5486f",
  "feature_request": "Feature B",
  "status": "implementing",
  "created_at": "2026-01-07T13:02:57.147520Z",
  "updated_at": "2026-01-07T13:02:57.154924Z",
  "git_context": {
    "branch": "feat-orchestrate-flow",
    "commit": "b9dc8fd35ba862a6b43a7fb1f681f09eba00b4d7",
    "repo_root": "/home/ll931217/GitHub/dotfiles.feat-orchestrate-flow",
    "is_worktree": true,
    "worktree_name": "worktrees"
  },
  "statistics": {
    "total_tasks": 0,
    "completed_tasks": 0,
    "failed_tasks": 0,
    "decisions_made": 0,
    "checkpoints_created": 0,
    "error_recovery_count": 0,
    "duration_seconds": 0.0
  },
  "configuration": {
    "max_iterations": 3,
    "timeout_minutes": 120,
    "auto_checkpoint": true,
    "error_recovery_enabled": true
  }
}