{
  "session_id": "3f01b541-5cc9-47a7-9f8b-d884159c705f",
  "feature_request": "Add user authentication with OAuth support",
  "status": "completed",
  "created_at": "2026-01-07T13:02:57.119275Z",
  "updated_at": "2026-01-07T13:02:57.130691Z",
  "completed_at": "2026-01-07T13:02:57.130514Z",
  "git_context": {
    "branch": "feat-orchestrate-flow",
    "commit": "b9dc8fd35ba862a6b43a7fb1f681f09eba00b4d7",
    "repo_root": "/home/ll931217/GitHub/dotfiles.feat-orchestrate-flow",
    "is_worktree": true,
    "worktree_name": "worktrees"
  },
  "current_phase": "implement",
  "statistics": {
    "total_tasks": 8,
    "completed_tasks": 3,
    "failed_tasks": 0,
    "decisions_made": 2,
    "checkpoints_created": 0,
    "error_recovery_count": 0,
    "duration_seconds": 0.0
  },
  "configuration": {
    "max_iterations": 3,
    "timeout_minutes": 120,
    "auto_checkpoint": true,
    "error_recovery_enabled": true
  }
}