{
  "session_id": "21285640-5215-4cea-9663-b830592aa680",
  "feature_request": "Real-time chat application with WebSocket support",
  "status": "completed",
  "created_at": "2026-01-07T13:02:57.187141Z",
  "updated_at": "2026-01-07T13:02:57.203780Z",
  "completed_at": "2026-01-07T13:02:57.203647Z",
  "git_context": {
    "branch": "feat-orchestrate-flow",
    "commit": "b9dc8fd35ba862a6b43a7fb1f681f09eba00b4d7",
    "repo_root": "/home/ll931217/GitHub/dotfiles.feat-orchestrate-flow",
    "is_worktree": true,
    "worktree_name": "worktrees"
  },
  "current_phase": "cleanup",
  "prd_reference": {
    "filename": "prd-chat-app.md",
    "path": "/home/ll931217/GitHub/dotfiles.feat-orchestrate-flow/.flow/maestro/prd-chat-app.md",
    "version": "1.0.0"
  },
  "statistics": {
    "total_tasks": 15,
    "completed_tasks": 15,
    "failed_tasks": 0,
    "decisions_made": 5,
    "checkpoints_created": 3,
    "error_recovery_count": 0,
    "duration_seconds": 0.0
  },
  "configuration": {
    "max_iterations": 5,
    "timeout_minutes": 180,
    "auto_checkpoint": true,
    "error_recovery_enabled": true
  }
}