{
  "session_id": "a047fa90-3ca8-48ee-b66a-c7cff97804d7",
  "feature_request": "Build REST API for user management",
  "status": "planning",
  "created_at": "2026-01-07T13:02:57.131092Z",
  "updated_at": "2026-01-07T13:02:57.139247Z",
  "git_context": {
    "branch": "feat-orchestrate-flow",
    "commit": "b9dc8fd35ba862a6b43a7fb1f681f09eba00b4d7",
    "repo_root": "/home/ll931217/GitHub/dotfiles.feat-orchestrate-flow",
    "is_worktree": true,
    "worktree_name": "worktrees"
  },
  "statistics": {
    "total_tasks": 0,
    "completed_tasks": 0,
    "failed_tasks": 0,
    "decisions_made": 0,
    "checkpoints_created": 0,
    "error_recovery_count": 0,
    "duration_seconds": 0.0
  },
  "configuration": {
    "max_iterations": 3,
    "timeout_minutes": 120,
    "auto_checkpoint": true,
    "error_recovery_enabled": true
  }
}